----------------------------------------------------------------------------
CrystalDiskInfo 8.12.8 (C) 2008-2021 hiyohiyo
                                Crystal Dew World: https://crystalmark.info/
----------------------------------------------------------------------------

    OS : Windows 11 Professional [10.0 Build 26100] (x64)
  Date : 2025/02/14 14:24:14

-- Controller Map ----------------------------------------------------------
 - Microsoft Storage Spaces Controller [SCSI]
 + Intel RST VMD Controller 9A0B [SCSI]
   - NVMe WDC PC SN530 SDBPNPZ-512G-1002
   - Generic software component
 - Intel RST VMD Managed Controller 09AB [SCSI]
 - Intel RST VMD Managed Controller 09AB [SCSI]

-- Disk List ---------------------------------------------------------------
 (01) WDC PC SN530 SDBPNPZ-512G-1002 : 512.1 GB [0/0/0, nt] - nv

----------------------------------------------------------------------------
 (01) WDC PC SN530 SDBPNPZ-512G-1002
----------------------------------------------------------------------------
           Model : WDC PC SN530 SDBPNPZ-512G-1002
        Firmware : 21106000
   Serial Number : 21420C805352
       Disk Size : 512.1 GB
     Buffer Size : Unknown
    # of Sectors : 
   Rotation Rate : ---- (SSD)
       Interface : NVM Express
   Major Version : NVM Express 1.4
   Minor Version : 
   Transfer Mode : ---- | ----
  Power On Hours : 1667 hours
  Power On Count : 875 count
      Host Reads : 39638 GB
     Host Writes : 34275 GB
     Temperature : 37 C (98 F)
   Health Status : Good (91 %)
        Features : S.M.A.R.T., TRIM, VolatileWriteCache
       APM Level : ----
       AAM Level : ----
    Drive Letter : C:

-- S.M.A.R.T. --------------------------------------------------------------
ID RawValues(6) Attribute Name
01 000000000000 Critical Warning
02 000000000136 Composite Temperature
03 000000000064 Available Spare
04 00000000000A Available Spare Threshold
05 000000000009 Percentage Used
06 000004F46F77 Data Units Read
07 00000448CEFB Data Units Written
08 00004021D9D3 Host Read Commands
09 0000486DB386 Host Write Commands
0A 000000001AAB Controller Busy Time
0B 00000000036B Power Cycles
0C 000000000683 Power On Hours
0D 00000000003D Unsafe Shutdowns
0E 000000000000 Media and Data Integrity Errors
0F 000000000001 Number of Error Information Log Entries

-- IDENTIFY_DEVICE ---------------------------------------------------------
        0    1    2    3    4    5    6    7    8    9
000: 15B7 15B7 3132 3234 4330 3038 3335 3235 2020 2020
010: 2020 2020 4457 2043 4350 5320 354E 3033 5320 4244
020: 4E50 5A50 352D 3231 2D47 3031 3230 2020 2020 2020
030: 2020 2020 3132 3031 3036 3030 4404 001B 0700 0001
040: 0400 0001 A120 0007 4240 000F 0200 0000 0002 0000
050: 0000 0000 0000 0000 0000 0100 0000 0000 0000 0000
060: 0000 0000 0000 0000 0000 0000 0000 0000 0000 0000
070: 0000 0000 0000 0000 0000 0000 0000 0000 0000 0000
080: 0000 0000 0000 0000 0000 0000 0000 0000 0000 0000
090: 0000 0000 0000 0000 0000 0000 0000 0000 0000 0000
100: 0000 0000 0000 0000 0000 0000 0000 0000 0000 0000
110: 0000 0000 0000 0000 0000 0000 0000 0000 0000 0000
120: 0000 0000 0000 0000 0000 0000 0000 0000 0017 0704
130: 1E14 04FF 0101 0161 0166 0032 C800 0000 0337 0000
140: 6000 3C25 0077 0000 0000 0000 0000 0000 0000 0000
150: 0000 0000 0000 0000 0000 0000 0000 0000 0039 0101
160: 0000 0001 0111 0166 0002 6000 0000 0000 0008 0000
170: 0000 0000 0000 0000 0000 0000 0001 0000 0000 0000
180: 0000 0000 0000 0000 0000 0000 0000 0000 0000 0000
190: 0000 0000 0000 0000 0000 0000 0000 0000 0000 0000
200: 0000 0000 0000 0000 0000 0000 0000 0000 0000 0000
210: 0000 0000 0000 0000 0000 0000 0000 0000 0000 0000
220: 0000 0000 0000 0000 0000 0000 0000 0000 0000 0000
230: 0000 0000 0000 0000 0000 0000 0000 0000 0000 0000
240: 0000 0000 0000 0000 0000 0000 0000 0000 0000 0000
250: 0000 0000 0000 0000 0000 0000

-- SMART_NVME --------------------------------------------------------------
     +0 +1 +2 +3 +4 +5 +6 +7 +8 +9 +A +B +C +D +E +F
000: 00 36 01 64 0A 09 00 00 00 00 00 00 00 00 00 00
010: 00 00 00 00 00 00 00 00 00 00 00 00 00 00 00 00
020: 77 6F F4 04 00 00 00 00 00 00 00 00 00 00 00 00
030: FC CE 48 04 00 00 00 00 00 00 00 00 00 00 00 00
040: D3 D9 21 40 00 00 00 00 00 00 00 00 00 00 00 00
050: AB B3 6D 48 00 00 00 00 00 00 00 00 00 00 00 00
060: AB 1A 00 00 00 00 00 00 00 00 00 00 00 00 00 00
070: 6B 03 00 00 00 00 00 00 00 00 00 00 00 00 00 00
080: 83 06 00 00 00 00 00 00 00 00 00 00 00 00 00 00
090: 3D 00 00 00 00 00 00 00 00 00 00 00 00 00 00 00
0A0: 00 00 00 00 00 00 00 00 00 00 00 00 00 00 00 00
0B0: 01 00 00 00 00 00 00 00 00 00 00 00 00 00 00 00
0C0: 00 00 00 00 00 00 00 00 00 00 00 00 00 00 00 00
0D0: 00 00 00 00 00 00 00 00 00 00 00 00 00 00 00 00
0E0: 00 00 00 00 00 00 00 00 00 00 00 00 00 00 00 00
0F0: 00 00 00 00 00 00 00 00 00 00 00 00 00 00 00 00
100: 00 00 00 00 00 00 00 00 00 00 00 00 00 00 00 00
110: 00 00 00 00 00 00 00 00 00 00 00 00 00 00 00 00
120: 00 00 00 00 00 00 00 00 00 00 00 00 00 00 00 00
130: 00 00 00 00 00 00 00 00 00 00 00 00 00 00 00 00
140: 00 00 00 00 00 00 00 00 00 00 00 00 00 00 00 00
150: 00 00 00 00 00 00 00 00 00 00 00 00 00 00 00 00
160: 00 00 00 00 00 00 00 00 00 00 00 00 00 00 00 00
170: 00 00 00 00 00 00 00 00 00 00 00 00 00 00 00 00
180: 00 00 00 00 00 00 00 00 00 00 00 00 00 00 00 00
190: 00 00 00 00 00 00 00 00 00 00 00 00 00 00 00 00
1A0: 00 00 00 00 00 00 00 00 00 00 00 00 00 00 00 00
1B0: 00 00 00 00 00 00 00 00 00 00 00 00 00 00 00 00
1C0: 00 00 00 00 00 00 00 00 00 00 00 00 00 00 00 00
1D0: 00 00 00 00 00 00 00 00 00 00 00 00 00 00 00 00
1E0: 00 00 00 00 00 00 00 00 00 00 00 00 00 00 00 00
1F0: 00 00 00 00 00 00 00 00 00 00 00 00 00 00 00 00

